{"schema_version":"aeriva-evidence/1","synthetic":true,"build":{"git_commit":"0000000000000000000000000000000000000000","branch":"SYNTHETIC-NO-BRANCH","build_type":"none","dirty_tree":false},"logs":[],"limitations":["EMULATOR_ONLY","SIMULATED_IMPAIRMENT","NO_WIRE_CAPTURE"],"test_id":"FIXTURE-EV-003","test_case_ref":"NC-B","layer":"L3","execution":{"executed":true,"runner_role":"SCRIPT","started_at":"2000-01-01T00:00:00Z","ended_at":"2000-01-01T00:00:01Z","run_ref":"synthetic-run-1"},"device":{"is_emulator":true,"device_ref":"EXAMPLE-EMU-1","manufacturer":"Google","model":"SYNTHETIC-EMULATOR","android_api":30,"device_class":"EMULATOR"},"network":{"transport":"CELLULAR","underlying_transport":null,"validated":true,"captive_portal_reported":false,"metered":true,"vpn_present":false,"blocked_by_policy":false,"private_dns_mode":"OFF","ip_family":"IPV4","carrier_label":null,"wifi_band":"NOT_APPLICABLE","ap_ref":null},"condition":{"scenario_id":"NC-B","impairment":{"tool":"EMULATOR_CONSOLE","added_delay_ms":200,"notes":"Console network delay set before the run"}},"endpoint":{"role":"LFS","endpoint_ref":"EXAMPLE-LFS-1"},"measurement":{"capability":"LATENCY","method_id":"https-h1-warm-exchange","outcome_kind":"MEASURED_SUCCEEDED","failure":null,"samples":[{"sequence_index":0,"ok":true,"value_ms":10,"connection_state":"WARM"},{"sequence_index":1,"ok":true,"value_ms":20,"connection_state":"WARM"},{"sequence_index":2,"ok":true,"value_ms":30,"connection_state":"WARM"},{"sequence_index":3,"ok":true,"value_ms":40,"connection_state":"WARM"}],"derived":{"average_ms":25,"min_ms":10,"max_ms":40,"sample_count":4,"confidence":"Low"}},"expected":{"status_label":"EXPECTED","classification":"MEASURED_SUCCEEDED","pass_criteria":["Derived values equal FIX-LAT-001 expected values"],"tolerances":[{"name":"arithmetic","value":0,"unit":"ms","provenance":"FIXTURE_EXACT"}]},"observed":{"classification":"MEASURED_SUCCEEDED","summary":"SYNTHETIC EXAMPLE built from FIX-LAT-001. Not a real run."},"verdict":{"result":"PASS","reason":"Synthetic fixture arithmetic matches.","investigation_branch":"NOT_APPLICABLE"},"environment":{"site_label":"EXAMPLE-LAB","temperature_c":null,"battery_percent_start":null,"charging":null,"screen_state":"UNKNOWN","time_bucket":"UNKNOWN"}}
