{"schema_version":"aeriva-evidence/1","synthetic":true,"build":{"git_commit":"0000000000000000000000000000000000000000","branch":"SYNTHETIC-NO-BRANCH","build_type":"none","dirty_tree":false},"logs":[],"limitations":[],"test_id":"FIXTURE-EV-002","test_case_ref":"NC-G","layer":"L5","execution":{"executed":false,"runner_role":"NONE"},"device":{"is_emulator":false,"device_ref":"EXAMPLE-DEVICE-A","manufacturer":"EXAMPLE","model":"EXAMPLE-MID-TIER","android_api":34,"device_class":"MID"},"network":{"transport":"WIFI","underlying_transport":null,"validated":null,"captive_portal_reported":null,"metered":null,"vpn_present":null,"blocked_by_policy":null,"private_dns_mode":"UNKNOWN","ip_family":"UNKNOWN","carrier_label":null,"wifi_band":"UNKNOWN","ap_ref":"EXAMPLE-AP-1"},"condition":{"scenario_id":"NC-G","impairment":{"tool":"REAL_NETWORK","notes":"Captive portal network, sign-in not completed"}},"endpoint":{"role":"CRS","endpoint_ref":"EXAMPLE-CRS-1"},"measurement":{"capability":"HTTPS_REACHABILITY","method_id":"https-reachability","outcome_kind":"NOT_ATTEMPTED","failure":null,"samples":[],"derived":null},"expected":{"status_label":"REQUIRES_PHYSICAL_DEVICE","classification":"CaptivePortalSuspected","pass_criteria":["Interception signal and platform portal flag both recorded","State is CAPTIVE_PORTAL, never AVAILABLE"]},"observed":{"classification":null,"summary":"SYNTHETIC EXAMPLE. Blocked before execution."},"verdict":{"result":"BLOCKED","reason":"Blocked: INTERNET permission decision (contract OD-1) and a production client do not exist.","investigation_branch":"PERMISSION"}}
