{"schema_version":"aeriva-evidence/1","synthetic":true,"build":{"git_commit":"0000000000000000000000000000000000000000","branch":"SYNTHETIC-NO-BRANCH","build_type":"none","dirty_tree":false},"logs":[],"limitations":[],"test_id":"FIXTURE-EV-001","test_case_ref":"NC-A","layer":"L5","execution":{"executed":false,"runner_role":"NONE"},"device":{"is_emulator":false,"device_ref":"EXAMPLE-DEVICE-A","manufacturer":"EXAMPLE","model":"EXAMPLE-MID-TIER","android_api":34,"device_class":"MID"},"network":{"transport":"WIFI","underlying_transport":null,"validated":null,"captive_portal_reported":null,"metered":null,"vpn_present":null,"blocked_by_policy":null,"private_dns_mode":"UNKNOWN","ip_family":"UNKNOWN","carrier_label":null,"wifi_band":"UNKNOWN","ap_ref":"EXAMPLE-AP-1"},"condition":{"scenario_id":"NC-A","impairment":{"tool":"NONE"}},"endpoint":{"role":"CRS","endpoint_ref":"EXAMPLE-CRS-1"},"measurement":{"capability":"LATENCY","method_id":"https-h1-warm-exchange","outcome_kind":"NOT_ATTEMPTED","failure":null,"samples":[],"derived":null},"expected":{"status_label":"REQUIRES_PHYSICAL_DEVICE","classification":"MEASURED_SUCCEEDED","pass_criteria":["Every sample succeeds with a warm connection","Reference-server timing agrees within a tolerance derived from pilot data"],"tolerances":[{"name":"agreement_with_reference","value":0,"unit":"ms","provenance":"OWNER_DECISION"}]},"observed":{"classification":null,"summary":"SYNTHETIC EXAMPLE. Planned record, nothing executed."},"verdict":{"result":"NOT_RUN","reason":"Planned only. No production client exists yet.","investigation_branch":"NOT_APPLICABLE"}}
